{
  "schemaVersion": "vehicle-subclass-media-probe-v1",
  "sourceSha256": "aaaaaaaaaaaaaaaaaaaaaaaaaaaaaaaaaaaaaaaaaaaaaaaaaaaaaaaaaaaaaaaa",
  "sourceSizeBytes": 104857600,
  "ffprobe": {
    "version": "9.0.1-essentials_build-www.gyan.dev",
    "sha256": "1111111111111111111111111111111111111111111111111111111111111111"
  },
  "format": {
    "formatName": "mov,mp4,m4a,3gp,3g2,mj2",
    "majorBrand": "isom",
    "durationMs": 300000
  },
  "videoStreamCount": 1,
  "video": {
    "codec": "h264",
    "profile": "High",
    "width": 1920,
    "height": 1080,
    "frameRateNumerator": 10,
    "frameRateDenominator": 1,
    "durationMs": 300000,
    "frameCount": 3000,
    "frameCountSource": "container"
  },
  "maviImport": {
    "policy": "phase1-mp4-container-v1",
    "containerSupported": true,
    "metadataValid": true
  }
}
